{
  "$schema": "../../schemas/map.schema.json",
  "id": 137,
  "name": "GameCornerPrizeRoom",
  "header": {
    "tileset": "Lobby",
    "music": "Celadon",
    "connectionFlags": 0,
    "width": 5,
    "height": 4,
    "borderBlock": 15
  },
  "connections": {},
  "warps": [
    {
      "x": 4,
      "y": 7,
      "destWarpId": 9
    },
    {
      "x": 5,
      "y": 7,
      "destWarpId": 9
    }
  ],
  "npcs": [
    {
      "spriteId": 52,
      "spriteName": "BaldingGuy",
      "x": 1,
      "y": 4,
      "movement": "Stationary",
      "facing": "Down",
      "range": 0,
      "textId": 1,
      "isTrainer": false
    },
    {
      "spriteId": 11,
      "spriteName": "Gambler",
      "x": 7,
      "y": 3,
      "movement": "Wander",
      "facing": "Left",
      "range": 2,
      "textId": 2,
      "isTrainer": false
    }
  ],
  "signs": [
    {
      "x": 2,
      "y": 2,
      "textId": 1
    },
    {
      "x": 4,
      "y": 2,
      "textId": 2
    },
    {
      "x": 6,
      "y": 2,
      "textId": 3
    }
  ],
  "text": {},
  "wild": null
}
