{
  "$schema": "../../schemas/map.schema.json",
  "id": 17,
  "name": "Route6",
  "header": {
    "tileset": "Overworld",
    "music": "Routes3",
    "connectionFlags": 12,
    "width": 10,
    "height": 18,
    "borderBlock": 15
  },
  "connections": {
    "north": {
      "targetMap": "SaffronCity",
      "offset": -5
    },
    "south": {
      "targetMap": "VermilionCity",
      "offset": -5
    }
  },
  "warps": [
    {
      "x": 9,
      "y": 1,
      "destMap": "Route6Gate",
      "destWarpId": 2
    },
    {
      "x": 10,
      "y": 1,
      "destMap": "Route6Gate",
      "destWarpId": 2
    },
    {
      "x": 10,
      "y": 7,
      "destMap": "Route6Gate",
      "destWarpId": 0
    },
    {
      "x": 17,
      "y": 13,
      "destMap": "UndergroundPathRoute6",
      "destWarpId": 0
    }
  ],
  "npcs": [
    {
      "spriteId": 7,
      "spriteName": "CooltrainerM",
      "x": 10,
      "y": 21,
      "movement": "Stationary",
      "facing": "Right",
      "movementByte2": 211,
      "range": 2,
      "textId": 1,
      "isTrainer": true,
      "trainerClass": "JrTrainerM",
      "trainerSet": 4,
      "endBattleText": "I\njust can't win!"
    },
    {
      "spriteId": 6,
      "spriteName": "CooltrainerF",
      "x": 11,
      "y": 21,
      "movement": "Stationary",
      "facing": "Left",
      "movementByte2": 210,
      "range": 2,
      "textId": 2,
      "isTrainer": true,
      "trainerClass": "JrTrainerF",
      "trainerSet": 2,
      "endBattleText": "Ugh!\nI hate losing!"
    },
    {
      "spriteId": 4,
      "spriteName": "Youngster",
      "x": 0,
      "y": 15,
      "movement": "Stationary",
      "facing": "Right",
      "movementByte2": 211,
      "range": 2,
      "textId": 3,
      "isTrainer": true,
      "trainerClass": "BugCatcher",
      "trainerSet": 10,
      "endBattleText": "No!\nYou're kidding!"
    },
    {
      "spriteId": 7,
      "spriteName": "CooltrainerM",
      "x": 11,
      "y": 31,
      "movement": "Stationary",
      "facing": "Left",
      "movementByte2": 210,
      "range": 2,
      "textId": 4,
      "isTrainer": true,
      "trainerClass": "JrTrainerM",
      "trainerSet": 5,
      "endBattleText": "I\ndidn't start it!"
    },
    {
      "spriteId": 6,
      "spriteName": "CooltrainerF",
      "x": 11,
      "y": 30,
      "movement": "Stationary",
      "facing": "Left",
      "movementByte2": 210,
      "range": 2,
      "textId": 5,
      "isTrainer": true,
      "trainerClass": "JrTrainerF",
      "trainerSet": 3,
      "endBattleText": "Just\ndidn't work!"
    },
    {
      "spriteId": 4,
      "spriteName": "Youngster",
      "x": 19,
      "y": 26,
      "movement": "Stationary",
      "facing": "Left",
      "movementByte2": 210,
      "range": 2,
      "textId": 6,
      "isTrainer": true,
      "trainerClass": "BugCatcher",
      "trainerSet": 11,
      "endBattleText": "You\nare too good!"
    }
  ],
  "signs": [
    {
      "x": 19,
      "y": 15,
      "textId": 1
    }
  ],
  "text": {
    "npc": {
      "1": [
        {
          "line1": "Who's there?",
          "line2": "Quit listening in"
        },
        {
          "line1": "on us!",
          "line2": ""
        }
      ],
      "1_Defeated": [
        {
          "line1": "I",
          "line2": "just can't win!"
        }
      ],
      "1_AfterBattle": [
        {
          "line1": "Whisper...",
          "line2": "whisper..."
        }
      ],
      "2": [
        {
          "line1": "Excuse me! This",
          "line2": "is a private"
        },
        {
          "line1": "conversation!",
          "line2": ""
        }
      ],
      "2_Defeated": [
        {
          "line1": "Ugh!",
          "line2": "I hate losing!"
        }
      ],
      "2_AfterBattle": [
        {
          "line1": "Whisper...",
          "line2": "whisper..."
        }
      ],
      "3": [
        {
          "line1": "There aren't many",
          "line2": "bugs out here."
        }
      ],
      "3_Defeated": [
        {
          "line1": "No!",
          "line2": "You're kidding!"
        }
      ],
      "3_AfterBattle": [
        {
          "line1": "I like bugs, so",
          "line2": "I'm going back to"
        },
        {
          "line1": "VIRIDIAN FOREST.",
          "line2": ""
        }
      ],
      "4": [
        {
          "line1": "Huh? You want",
          "line2": "to talk to me?"
        }
      ],
      "4_Defeated": [
        {
          "line1": "I",
          "line2": "didn't start it!"
        }
      ],
      "4_AfterBattle": [
        {
          "line1": "I should carry",
          "line2": "more #MON with"
        },
        {
          "line1": "me for safety.",
          "line2": ""
        }
      ],
      "5": [
        {
          "line1": "Me? Well, OK.",
          "line2": "I'll play!"
        }
      ],
      "5_Defeated": [
        {
          "line1": "Just",
          "line2": "didn't work!"
        }
      ],
      "5_AfterBattle": [
        {
          "line1": "I want to get",
          "line2": "stronger! What's"
        },
        {
          "line1": "your secret?",
          "line2": ""
        }
      ],
      "6": [
        {
          "line1": "I've never seen",
          "line2": "you around!"
        },
        {
          "line1": "Are you good?",
          "line2": ""
        }
      ],
      "6_Defeated": [
        {
          "line1": "You",
          "line2": "are too good!"
        }
      ],
      "6_AfterBattle": [
        {
          "line1": "Are my #MON",
          "line2": "weak? Or, am I"
        },
        {
          "line1": "just bad?",
          "line2": ""
        }
      ]
    },
    "sign": {
      "1": [
        {
          "line1": "UNDERGROUND PATH",
          "line2": "CERULEAN CITY -"
        },
        {
          "line1": "VERMILION CITY",
          "line2": ""
        }
      ]
    }
  },
  "wild": {
    "red": {
      "grass": {
        "encounterRate": 15,
        "mons": [
          {
            "level": 13,
            "species": "Oddish"
          },
          {
            "level": 13,
            "species": "Pidgey"
          },
          {
            "level": 15,
            "species": "Pidgey"
          },
          {
            "level": 10,
            "species": "Mankey"
          },
          {
            "level": 12,
            "species": "Mankey"
          },
          {
            "level": 15,
            "species": "Oddish"
          },
          {
            "level": 16,
            "species": "Oddish"
          },
          {
            "level": 16,
            "species": "Pidgey"
          },
          {
            "level": 14,
            "species": "Mankey"
          },
          {
            "level": 16,
            "species": "Mankey"
          }
        ]
      },
      "water": {
        "encounterRate": 0,
        "mons": []
      }
    },
    "blue": {
      "grass": {
        "encounterRate": 15,
        "mons": [
          {
            "level": 13,
            "species": "Bellsprout"
          },
          {
            "level": 13,
            "species": "Pidgey"
          },
          {
            "level": 15,
            "species": "Pidgey"
          },
          {
            "level": 10,
            "species": "Meowth"
          },
          {
            "level": 12,
            "species": "Meowth"
          },
          {
            "level": 15,
            "species": "Bellsprout"
          },
          {
            "level": 16,
            "species": "Bellsprout"
          },
          {
            "level": 16,
            "species": "Pidgey"
          },
          {
            "level": 14,
            "species": "Meowth"
          },
          {
            "level": 16,
            "species": "Meowth"
          }
        ]
      },
      "water": {
        "encounterRate": 0,
        "mons": []
      }
    }
  }
}
