{
  "$schema": "../../schemas/map.schema.json",
  "id": 103,
  "name": "SSAnne2FRooms",
  "header": {
    "tileset": "Ship",
    "music": "SSAnne",
    "connectionFlags": 0,
    "width": 12,
    "height": 8,
    "borderBlock": 12
  },
  "connections": {},
  "warps": [
    {
      "x": 2,
      "y": 5,
      "destMap": "SSAnne2F",
      "destWarpId": 0
    },
    {
      "x": 3,
      "y": 5,
      "destMap": "SSAnne2F",
      "destWarpId": 0
    },
    {
      "x": 12,
      "y": 5,
      "destMap": "SSAnne2F",
      "destWarpId": 1
    },
    {
      "x": 13,
      "y": 5,
      "destMap": "SSAnne2F",
      "destWarpId": 1
    },
    {
      "x": 22,
      "y": 5,
      "destMap": "SSAnne2F",
      "destWarpId": 2
    },
    {
      "x": 23,
      "y": 5,
      "destMap": "SSAnne2F",
      "destWarpId": 2
    },
    {
      "x": 2,
      "y": 15,
      "destMap": "SSAnne2F",
      "destWarpId": 3
    },
    {
      "x": 3,
      "y": 15,
      "destMap": "SSAnne2F",
      "destWarpId": 3
    },
    {
      "x": 12,
      "y": 15,
      "destMap": "SSAnne2F",
      "destWarpId": 4
    },
    {
      "x": 13,
      "y": 15,
      "destMap": "SSAnne2F",
      "destWarpId": 4
    },
    {
      "x": 22,
      "y": 15,
      "destMap": "SSAnne2F",
      "destWarpId": 5
    },
    {
      "x": 23,
      "y": 15,
      "destMap": "SSAnne2F",
      "destWarpId": 5
    }
  ],
  "npcs": [
    {
      "spriteId": 16,
      "spriteName": "Gentleman",
      "x": 10,
      "y": 2,
      "movement": "Stationary",
      "facing": "Right",
      "movementByte2": 211,
      "range": 0,
      "textId": 1,
      "isTrainer": true,
      "trainerClass": "Gentleman",
      "trainerSet": 3,
      "endBattleText": "Good\nfight! Ah, I feel\nyoung again!"
    },
    {
      "spriteId": 47,
      "spriteName": "Fisher",
      "x": 13,
      "y": 4,
      "movement": "Stationary",
      "facing": "Left",
      "movementByte2": 210,
      "range": 0,
      "textId": 2,
      "isTrainer": true,
      "trainerClass": "Fisher",
      "trainerSet": 1,
      "endBattleText": "I'm\nall out!"
    },
    {
      "spriteId": 16,
      "spriteName": "Gentleman",
      "x": 0,
      "y": 14,
      "movement": "Stationary",
      "facing": "Right",
      "movementByte2": 211,
      "range": 0,
      "textId": 3,
      "isTrainer": true,
      "trainerClass": "Gentleman",
      "trainerSet": 5,
      "endBattleText": "I must\nsalute you!"
    },
    {
      "spriteId": 6,
      "spriteName": "CooltrainerF",
      "x": 2,
      "y": 11,
      "movement": "Stationary",
      "facing": "Down",
      "movementByte2": 208,
      "range": 0,
      "textId": 4,
      "isTrainer": true,
      "trainerClass": "Lass",
      "trainerSet": 12,
      "endBattleText": "Take\nit easy!"
    },
    {
      "spriteId": 16,
      "spriteName": "Gentleman",
      "x": 1,
      "y": 2,
      "movement": "Stationary",
      "facing": "Down",
      "movementByte2": 208,
      "range": 0,
      "textId": 5,
      "isTrainer": false
    },
    {
      "spriteId": 61,
      "spriteName": "PokeBall",
      "x": 12,
      "y": 1,
      "movement": "Stationary",
      "facing": "Down",
      "movementByte2": 255,
      "range": 255,
      "textId": 6,
      "isTrainer": false,
      "itemId": 81
    },
    {
      "spriteId": 16,
      "spriteName": "Gentleman",
      "x": 21,
      "y": 2,
      "movement": "Stationary",
      "facing": "Down",
      "movementByte2": 208,
      "range": 0,
      "textId": 7,
      "isTrainer": false
    },
    {
      "spriteId": 37,
      "spriteName": "Gramps",
      "x": 22,
      "y": 1,
      "movement": "Stationary",
      "facing": "Down",
      "movementByte2": 208,
      "range": 0,
      "textId": 8,
      "isTrainer": false
    },
    {
      "spriteId": 61,
      "spriteName": "PokeBall",
      "x": 0,
      "y": 12,
      "movement": "Stationary",
      "facing": "Down",
      "movementByte2": 255,
      "range": 255,
      "textId": 9,
      "isTrainer": false,
      "itemId": 40
    },
    {
      "spriteId": 16,
      "spriteName": "Gentleman",
      "x": 12,
      "y": 12,
      "movement": "Stationary",
      "facing": "Down",
      "movementByte2": 208,
      "range": 0,
      "textId": 10,
      "isTrainer": false
    },
    {
      "spriteId": 53,
      "spriteName": "LittleBoy",
      "x": 11,
      "y": 14,
      "movement": "Stationary",
      "facing": "Down",
      "movementByte2": 255,
      "range": 255,
      "textId": 11,
      "isTrainer": false
    },
    {
      "spriteId": 29,
      "spriteName": "BrunetteGirl",
      "x": 22,
      "y": 12,
      "movement": "Stationary",
      "facing": "Left",
      "movementByte2": 210,
      "range": 0,
      "textId": 12,
      "isTrainer": false
    },
    {
      "spriteId": 15,
      "spriteName": "Beauty",
      "x": 20,
      "y": 12,
      "movement": "Stationary",
      "facing": "Right",
      "movementByte2": 211,
      "range": 0,
      "textId": 13,
      "isTrainer": false
    }
  ],
  "signs": [],
  "text": {
    "npc": {
      "1": [
        {
          "line1": "Competing against",
          "line2": "the young keeps"
        },
        {
          "line1": "me youthful.",
          "line2": ""
        }
      ],
      "1_Defeated": [
        {
          "line1": "Good",
          "line2": "fight! Ah, I feel"
        },
        {
          "line1": "young again!",
          "line2": ""
        }
      ],
      "1_AfterBattle": [
        {
          "line1": "15 years ago, I",
          "line2": "would have won!"
        }
      ],
      "2": [
        {
          "line1": "Check out what I",
          "line2": "fished up!"
        }
      ],
      "2_Defeated": [
        {
          "line1": "I'm",
          "line2": "all out!"
        }
      ],
      "2_AfterBattle": [
        {
          "line1": "Party?",
          "line2": ""
        },
        {
          "line1": "",
          "line2": ""
        },
        {
          "line1": "The cruise ship's",
          "line2": "party should be"
        },
        {
          "line1": "over by now.",
          "line2": ""
        }
      ],
      "3": [
        {
          "line1": "Which do you like,",
          "line2": "a strong or a"
        },
        {
          "line1": "rare #MON?",
          "line2": ""
        }
      ],
      "3_Defeated": [
        {
          "line1": "I must",
          "line2": "salute you!"
        }
      ],
      "3_AfterBattle": [
        {
          "line1": "I prefer strong",
          "line2": "and rare #MON."
        }
      ],
      "4": [
        {
          "line1": "I never saw you",
          "line2": "at the party."
        }
      ],
      "4_Defeated": [
        {
          "line1": "Take",
          "line2": "it easy!"
        }
      ],
      "4_AfterBattle": [
        {
          "line1": "Oh, I adore your",
          "line2": "strong #MON!"
        }
      ],
      "5": [
        {
          "line1": "In all my travels",
          "line2": "I've never seen"
        },
        {
          "line1": "any #MON sleep",
          "line2": "like this one!"
        },
        {
          "line1": "",
          "line2": ""
        },
        {
          "line1": "It was something",
          "line2": "like this!"
        }
      ],
      "7": [
        {
          "line1": "Have you gone to",
          "line2": "the SAFARI ZONE"
        },
        {
          "line1": "in FUCHSIA CITY?",
          "line2": ""
        },
        {
          "line1": "",
          "line2": ""
        },
        {
          "line1": "It had many rare",
          "line2": "kinds of #MON!!"
        }
      ],
      "8": [
        {
          "line1": "#MON can CUT",
          "line2": "down small bushes."
        }
      ],
      "10": [
        {
          "line1": "Ah yes, I have",
          "line2": "seen some #MON"
        },
        {
          "line1": "ferry people",
          "line2": "across the water!"
        }
      ],
      "11": [
        {
          "line1": "Me and my Daddy",
          "line2": "think the SAFARI"
        },
        {
          "line1": "ZONE is awesome!",
          "line2": ""
        }
      ],
      "12": [
        {
          "line1": "The CAPTAIN looked",
          "line2": "really sick and"
        },
        {
          "line1": "pale!",
          "line2": ""
        }
      ],
      "13": [
        {
          "line1": "I hear many people",
          "line2": "get seasick!"
        }
      ]
    }
  },
  "wild": null
}
