{
  "$schema": "../../schemas/map.schema.json",
  "id": 63,
  "name": "CeruleanTradeHouse",
  "header": {
    "tileset": "House",
    "music": "Cities2",
    "connectionFlags": 0,
    "width": 4,
    "height": 4,
    "borderBlock": 10
  },
  "connections": {},
  "warps": [
    {
      "x": 2,
      "y": 7,
      "destWarpId": 1
    },
    {
      "x": 3,
      "y": 7,
      "destWarpId": 1
    }
  ],
  "npcs": [
    {
      "spriteId": 40,
      "spriteName": "Granny",
      "x": 5,
      "y": 4,
      "movement": "Stationary",
      "facing": "Left",
      "range": 0,
      "textId": 1,
      "isTrainer": false
    },
    {
      "spriteId": 11,
      "spriteName": "Gambler",
      "x": 1,
      "y": 2,
      "movement": "Stationary",
      "facing": "Down",
      "range": 0,
      "textId": 2,
      "isTrainer": false
    }
  ],
  "signs": [],
  "text": {
    "npc": {
      "1": [
        {
          "line1": "My husband likes",
          "line2": "trading #MON."
        },
        {
          "line1": "If you are a",
          "line2": "collector, would"
        },
        {
          "line1": "you please trade",
          "line2": "with him?"
        }
      ],
      "2": [
        {
          "line1": "[In-game trade script]",
          "line2": ""
        }
      ]
    },
    "sign": {}
  },
  "wild": null
}
