{
  "$schema": "../../schemas/map.schema.json",
  "id": 158,
  "name": "FuchsiaMeetingRoom",
  "header": {
    "tileset": "Lab",
    "music": "Cities2",
    "connectionFlags": 0,
    "width": 7,
    "height": 4,
    "borderBlock": 23
  },
  "connections": {},
  "warps": [
    {
      "x": 4,
      "y": 7,
      "destWarpId": 6
    },
    {
      "x": 5,
      "y": 7,
      "destWarpId": 6
    }
  ],
  "npcs": [
    {
      "spriteId": 35,
      "spriteName": "SafariZoneWorker",
      "x": 4,
      "y": 1,
      "movement": "Stationary",
      "facing": "Down",
      "movementByte2": 208,
      "range": 0,
      "textId": 1,
      "isTrainer": false
    },
    {
      "spriteId": 35,
      "spriteName": "SafariZoneWorker",
      "x": 0,
      "y": 2,
      "movement": "Stationary",
      "facing": "Up",
      "movementByte2": 209,
      "range": 0,
      "textId": 2,
      "isTrainer": false
    },
    {
      "spriteId": 35,
      "spriteName": "SafariZoneWorker",
      "x": 10,
      "y": 1,
      "movement": "Stationary",
      "facing": "Down",
      "movementByte2": 208,
      "range": 0,
      "textId": 3,
      "isTrainer": false
    }
  ],
  "signs": [],
  "text": {},
  "wild": null
}
