{
  "$schema": "../../schemas/map.schema.json",
  "id": 75,
  "name": "UndergroundPathRoute6Copy",
  "header": {
    "tileset": "Overworld",
    "music": "Vermilion",
    "connectionFlags": 0,
    "width": 4,
    "height": 4,
    "borderBlock": 0
  },
  "connections": {},
  "warps": [],
  "npcs": [],
  "signs": [],
  "text": {},
  "wild": null
}
