{
  "$schema": "../../schemas/map.schema.json",
  "id": 1,
  "name": "ViridianCity",
  "header": {
    "tileset": "Overworld",
    "music": "Cities1",
    "connectionFlags": 14,
    "width": 20,
    "height": 18,
    "borderBlock": 15
  },
  "connections": {
    "north": {
      "targetMap": "Route2",
      "offset": 5
    },
    "south": {
      "targetMap": "Route1",
      "offset": 5
    },
    "west": {
      "targetMap": "Route22",
      "offset": 4
    }
  },
  "warps": [
    {
      "x": 23,
      "y": 25,
      "destMap": "ViridianPokecenter",
      "destWarpId": 0
    },
    {
      "x": 29,
      "y": 19,
      "destMap": "ViridianMart",
      "destWarpId": 0
    },
    {
      "x": 21,
      "y": 15,
      "destMap": "ViridianSchoolHouse",
      "destWarpId": 0
    },
    {
      "x": 21,
      "y": 9,
      "destMap": "ViridianNicknameHouse",
      "destWarpId": 0
    },
    {
      "x": 32,
      "y": 7,
      "destMap": "ViridianGym",
      "destWarpId": 0
    }
  ],
  "npcs": [
    {
      "spriteId": 4,
      "spriteName": "Youngster",
      "x": 13,
      "y": 20,
      "movement": "Wander",
      "facing": "Down",
      "range": 0,
      "textId": 1,
      "isTrainer": false
    },
    {
      "spriteId": 11,
      "spriteName": "Gambler",
      "x": 30,
      "y": 8,
      "movement": "Stationary",
      "facing": "Down",
      "range": 0,
      "textId": 2,
      "isTrainer": false
    },
    {
      "spriteId": 4,
      "spriteName": "Youngster",
      "x": 30,
      "y": 25,
      "movement": "Wander",
      "facing": "Down",
      "range": 0,
      "textId": 3,
      "isTrainer": false
    },
    {
      "spriteId": 13,
      "spriteName": "Girl",
      "x": 17,
      "y": 9,
      "movement": "Stationary",
      "facing": "Right",
      "range": 0,
      "textId": 4,
      "isTrainer": false
    },
    {
      "spriteId": 72,
      "spriteName": "GamblerAsleep",
      "x": 18,
      "y": 9,
      "movement": "Stationary",
      "facing": "Down",
      "range": 0,
      "textId": 5,
      "isTrainer": false
    },
    {
      "spriteId": 47,
      "spriteName": "Fisher",
      "x": 6,
      "y": 23,
      "movement": "Stationary",
      "facing": "Down",
      "range": 0,
      "textId": 6,
      "isTrainer": false
    },
    {
      "spriteId": 11,
      "spriteName": "Gambler",
      "x": 17,
      "y": 5,
      "movement": "Wander",
      "facing": "Left",
      "range": 2,
      "textId": 7,
      "isTrainer": false
    }
  ],
  "signs": [
    {
      "x": 17,
      "y": 17,
      "textId": 1
    },
    {
      "x": 19,
      "y": 1,
      "textId": 2
    },
    {
      "x": 21,
      "y": 29,
      "textId": 3
    },
    {
      "x": 30,
      "y": 19,
      "textId": 4
    },
    {
      "x": 24,
      "y": 25,
      "textId": 5
    },
    {
      "x": 27,
      "y": 7,
      "textId": 6
    }
  ],
  "text": {
    "npc": {
      "1": [
        {
          "line1": "Those POKe BALLs",
          "line2": "at your waist!"
        },
        {
          "line1": "You have POKeMON!",
          "line2": ""
        },
        {
          "line1": "It's great that",
          "line2": "you can carry and"
        },
        {
          "line1": "use POKeMON any",
          "line2": "time, anywhere!"
        }
      ],
      "2": [
        {
          "line1": "This POKeMON GYM",
          "line2": "is always closed."
        },
        {
          "line1": "I wonder who the",
          "line2": "LEADER is?"
        }
      ],
      "2_GymLeaderReturned": [
        {
          "line1": "VIRIDIAN GYM's",
          "line2": "LEADER returned!"
        }
      ],
      "3": [
        {
          "line1": "You want to know",
          "line2": "about the 2 kinds"
        },
        {
          "line1": "of caterpillar",
          "line2": "POKeMON?"
        }
      ],
      "3_Yes": [
        {
          "line1": "CATERPIE has no",
          "line2": "poison, but"
        },
        {
          "line1": "WEEDLE does.",
          "line2": ""
        },
        {
          "line1": "Watch out for its",
          "line2": "POISON STING!"
        }
      ],
      "3_No": [
        {
          "line1": "Oh, OK then!",
          "line2": ""
        }
      ],
      "4_NoPokedex": [
        {
          "line1": "Oh Grandpa! Don't",
          "line2": "be so mean!"
        },
        {
          "line1": "He hasn't had his",
          "line2": "coffee yet."
        }
      ],
      "4_HasPokedex": [
        {
          "line1": "When I go shop in",
          "line2": "PEWTER CITY, I"
        },
        {
          "line1": "have to take the",
          "line2": "winding trail in"
        },
        {
          "line1": "VIRIDIAN FOREST.",
          "line2": ""
        }
      ],
      "5": [
        {
          "line1": "You can't go",
          "line2": "through here!"
        },
        {
          "line1": "This is private",
          "line2": "property!"
        }
      ],
      "6": [
        {
          "line1": "Yawn!",
          "line2": "I must have dozed"
        },
        {
          "line1": "off in the sun.",
          "line2": ""
        },
        {
          "line1": "I had this dream",
          "line2": "about a DROWZEE"
        },
        {
          "line1": "eating my dream.",
          "line2": "What's this?"
        },
        {
          "line1": "Where did this TM",
          "line2": "come from?"
        },
        {
          "line1": "This is spooky!",
          "line2": "Here, you can"
        },
        {
          "line1": "have this TM.",
          "line2": ""
        }
      ],
      "6_ReceivedTM42": [
        {
          "line1": "<PLAYER> received",
          "line2": "TM42!"
        }
      ],
      "6_TM42Explanation": [
        {
          "line1": "TM42 contains",
          "line2": "DREAM EATER..."
        },
        {
          "line1": "...Snore...",
          "line2": ""
        }
      ],
      "6_NoRoom": [
        {
          "line1": "You have too much",
          "line2": "stuff already."
        }
      ],
      "7_HadCoffeeNo": [
        {
          "line1": "Ahh, I've had my",
          "line2": "coffee now and I"
        },
        {
          "line1": "feel great!",
          "line2": ""
        },
        {
          "line1": "Sure you can go",
          "line2": "through!"
        },
        {
          "line1": "Are you in a",
          "line2": "hurry?"
        }
      ],
      "7_HadCoffeeYes": [
        {
          "line1": "Time is money...",
          "line2": "Go along then."
        }
      ],
      "7_HadCoffeeNoCatchTutorial": [
        {
          "line1": "I see you're using",
          "line2": "a POKeDEX."
        },
        {
          "line1": "When you catch a",
          "line2": "POKeMON, POKeDEX"
        },
        {
          "line1": "is automatically",
          "line2": "updated."
        },
        {
          "line1": "What? Don't you",
          "line2": "know how to catch"
        },
        {
          "line1": "POKeMON?",
          "line2": ""
        },
        {
          "line1": "I'll show you",
          "line2": "how to then."
        }
      ],
      "script_WeakenTarget": [
        {
          "line1": "First, you need",
          "line2": "to weaken the"
        },
        {
          "line1": "target POKeMON.",
          "line2": ""
        }
      ],
      "script_GymLocked": [
        {
          "line1": "The GYM's doors",
          "line2": "are locked..."
        }
      ]
    },
    "sign": {
      "1": [
        {
          "line1": "VIRIDIAN CITY",
          "line2": "The Eternally"
        },
        {
          "line1": "Green Paradise",
          "line2": ""
        }
      ],
      "2": [
        {
          "line1": "TRAINER TIPS",
          "line2": ""
        },
        {
          "line1": "Catch POKeMON",
          "line2": "and expand your"
        },
        {
          "line1": "collection!",
          "line2": ""
        },
        {
          "line1": "The more you have,",
          "line2": "the easier it is"
        },
        {
          "line1": "to fight!",
          "line2": ""
        }
      ],
      "3": [
        {
          "line1": "TRAINER TIPS",
          "line2": ""
        },
        {
          "line1": "The battle moves",
          "line2": "of POKeMON are"
        },
        {
          "line1": "limited by their",
          "line2": "POWER POINTs, PP."
        },
        {
          "line1": "To replenish PP,",
          "line2": "rest your tired"
        },
        {
          "line1": "POKeMON at a",
          "line2": "POKeMON CENTER!"
        }
      ],
      "4": [
        {
          "line1": "VIRIDIAN CITY",
          "line2": "POKeMON GYM"
        }
      ],
      "5": [
        {
          "line1": "VIRIDIAN CITY",
          "line2": "The Eternally"
        },
        {
          "line1": "Green Paradise",
          "line2": ""
        }
      ],
      "6": [
        {
          "line1": "VIRIDIAN CITY",
          "line2": "POKeMON GYM"
        }
      ]
    }
  },
  "wild": null
}
