{
  "$schema": "../../schemas/map.schema.json",
  "id": 169,
  "name": "CinnabarLabMetronomeRoom",
  "header": {
    "tileset": "Lab",
    "music": "Cinnabar",
    "connectionFlags": 0,
    "width": 4,
    "height": 4,
    "borderBlock": 23
  },
  "connections": {},
  "warps": [
    {
      "x": 2,
      "y": 7,
      "destMap": "CinnabarLab",
      "destWarpId": 3
    },
    {
      "x": 3,
      "y": 7,
      "destMap": "CinnabarLab",
      "destWarpId": 3
    }
  ],
  "npcs": [
    {
      "spriteId": 32,
      "spriteName": "Scientist",
      "x": 7,
      "y": 2,
      "movement": "Stationary",
      "facing": "Down",
      "movementByte2": 208,
      "range": 0,
      "textId": 1,
      "isTrainer": false
    },
    {
      "spriteId": 32,
      "spriteName": "Scientist",
      "x": 2,
      "y": 3,
      "movement": "Wander",
      "facing": "Left",
      "movementByte2": 2,
      "range": 2,
      "textId": 2,
      "isTrainer": false
    }
  ],
  "signs": [
    {
      "x": 0,
      "y": 4,
      "textId": 1
    },
    {
      "x": 1,
      "y": 4,
      "textId": 2
    },
    {
      "x": 2,
      "y": 1,
      "textId": 3
    }
  ],
  "text": {},
  "wild": null
}
