{
  "$schema": "../../schemas/map.schema.json",
  "id": 204,
  "name": "UnusedMapCC",
  "header": {
    "tileset": "Overworld",
    "music": "Dungeon1",
    "connectionFlags": 0,
    "width": 0,
    "height": 0,
    "borderBlock": 0
  },
  "connections": {},
  "warps": [],
  "npcs": [],
  "signs": [],
  "text": {},
  "wild": null
}
