{
  "$schema": "../../schemas/map.schema.json",
  "id": 10,
  "name": "SaffronCity",
  "header": {
    "tileset": "Overworld",
    "music": "Cities1",
    "connectionFlags": 15,
    "width": 20,
    "height": 18,
    "borderBlock": 15
  },
  "connections": {
    "north": {
      "targetMap": "Route5",
      "offset": 5
    },
    "south": {
      "targetMap": "Route6",
      "offset": 5
    },
    "west": {
      "targetMap": "Route7",
      "offset": 4
    },
    "east": {
      "targetMap": "Route8",
      "offset": 4
    }
  },
  "warps": [
    {
      "x": 7,
      "y": 5,
      "destMap": "CopycatsHouse1F",
      "destWarpId": 0
    },
    {
      "x": 26,
      "y": 3,
      "destMap": "FightingDojo",
      "destWarpId": 0
    },
    {
      "x": 34,
      "y": 3,
      "destMap": "SaffronGym",
      "destWarpId": 0
    },
    {
      "x": 13,
      "y": 11,
      "destMap": "SaffronPidgeyHouse",
      "destWarpId": 0
    },
    {
      "x": 25,
      "y": 11,
      "destMap": "SaffronMart",
      "destWarpId": 0
    },
    {
      "x": 18,
      "y": 21,
      "destMap": "SilphCo1F",
      "destWarpId": 0
    },
    {
      "x": 9,
      "y": 29,
      "destMap": "SaffronPokecenter",
      "destWarpId": 0
    },
    {
      "x": 29,
      "y": 29,
      "destMap": "MrPsychicsHouse",
      "destWarpId": 0
    }
  ],
  "npcs": [
    {
      "spriteId": 24,
      "spriteName": "Rocket",
      "x": 7,
      "y": 6,
      "movement": "Stationary",
      "facing": "Down",
      "movementByte2": 255,
      "range": 255,
      "textId": 1,
      "isTrainer": false
    },
    {
      "spriteId": 24,
      "spriteName": "Rocket",
      "x": 20,
      "y": 8,
      "movement": "Wander",
      "facing": "Left",
      "movementByte2": 2,
      "range": 2,
      "textId": 2,
      "isTrainer": false
    },
    {
      "spriteId": 24,
      "spriteName": "Rocket",
      "x": 34,
      "y": 4,
      "movement": "Stationary",
      "facing": "Down",
      "movementByte2": 255,
      "range": 255,
      "textId": 3,
      "isTrainer": false
    },
    {
      "spriteId": 24,
      "spriteName": "Rocket",
      "x": 13,
      "y": 12,
      "movement": "Stationary",
      "facing": "Down",
      "movementByte2": 255,
      "range": 255,
      "textId": 4,
      "isTrainer": false
    },
    {
      "spriteId": 24,
      "spriteName": "Rocket",
      "x": 11,
      "y": 25,
      "movement": "Wander",
      "facing": "Left",
      "movementByte2": 2,
      "range": 2,
      "textId": 5,
      "isTrainer": false
    },
    {
      "spriteId": 24,
      "spriteName": "Rocket",
      "x": 32,
      "y": 13,
      "movement": "Wander",
      "facing": "Left",
      "movementByte2": 2,
      "range": 2,
      "textId": 6,
      "isTrainer": false
    },
    {
      "spriteId": 24,
      "spriteName": "Rocket",
      "x": 18,
      "y": 30,
      "movement": "Wander",
      "facing": "Left",
      "movementByte2": 2,
      "range": 2,
      "textId": 7,
      "isTrainer": false
    },
    {
      "spriteId": 32,
      "spriteName": "Scientist",
      "x": 8,
      "y": 14,
      "movement": "Wander",
      "facing": "Down",
      "movementByte2": 0,
      "range": 0,
      "textId": 8,
      "isTrainer": false
    },
    {
      "spriteId": 44,
      "spriteName": "SilphWorkerM",
      "x": 23,
      "y": 23,
      "movement": "Stationary",
      "facing": "Down",
      "movementByte2": 255,
      "range": 255,
      "textId": 9,
      "isTrainer": false
    },
    {
      "spriteId": 27,
      "spriteName": "SilphWorkerF",
      "x": 17,
      "y": 30,
      "movement": "Wander",
      "facing": "Left",
      "movementByte2": 2,
      "range": 2,
      "textId": 10,
      "isTrainer": false
    },
    {
      "spriteId": 16,
      "spriteName": "Gentleman",
      "x": 30,
      "y": 12,
      "movement": "Stationary",
      "facing": "Down",
      "movementByte2": 208,
      "range": 0,
      "textId": 11,
      "isTrainer": false
    },
    {
      "spriteId": 9,
      "spriteName": "Bird",
      "x": 31,
      "y": 12,
      "movement": "Stationary",
      "facing": "Down",
      "movementByte2": 208,
      "range": 0,
      "textId": 12,
      "isTrainer": false
    },
    {
      "spriteId": 33,
      "spriteName": "Rocker",
      "x": 18,
      "y": 8,
      "movement": "Stationary",
      "facing": "Up",
      "movementByte2": 209,
      "range": 0,
      "textId": 13,
      "isTrainer": false
    },
    {
      "spriteId": 24,
      "spriteName": "Rocket",
      "x": 18,
      "y": 22,
      "movement": "Stationary",
      "facing": "Down",
      "movementByte2": 208,
      "range": 0,
      "textId": 14,
      "isTrainer": false
    },
    {
      "spriteId": 24,
      "spriteName": "Rocket",
      "x": 19,
      "y": 22,
      "movement": "Stationary",
      "facing": "Down",
      "movementByte2": 208,
      "range": 0,
      "textId": 15,
      "isTrainer": false
    }
  ],
  "signs": [
    {
      "x": 17,
      "y": 5,
      "textId": 1
    },
    {
      "x": 27,
      "y": 5,
      "textId": 2
    },
    {
      "x": 35,
      "y": 5,
      "textId": 3
    },
    {
      "x": 26,
      "y": 11,
      "textId": 4
    },
    {
      "x": 39,
      "y": 19,
      "textId": 5
    },
    {
      "x": 5,
      "y": 21,
      "textId": 6
    },
    {
      "x": 15,
      "y": 21,
      "textId": 7
    },
    {
      "x": 10,
      "y": 29,
      "textId": 8
    },
    {
      "x": 27,
      "y": 29,
      "textId": 9
    },
    {
      "x": 1,
      "y": 19,
      "textId": 10
    }
  ],
  "text": {},
  "wild": null
}
